{
  "canonical_digest": "sha256:ce870c05b3ca644834cb77cf315a7a469f01ede10b77b91b77365ebde104d3f4",
  "cases": [
    {
      "id": "POS-COMP-001",
      "path": "aset/shared/conformance/positive/POS-COMP-001.json"
    },
    {
      "id": "POS-COMP-002",
      "path": "aset/shared/conformance/positive/POS-COMP-002.json"
    },
    {
      "id": "POS-COMP-003",
      "path": "aset/shared/conformance/positive/POS-COMP-003.json"
    },
    {
      "id": "POS-COMP-004",
      "path": "aset/shared/conformance/positive/POS-COMP-004.json"
    },
    {
      "id": "POS-COMP-005",
      "path": "aset/shared/conformance/positive/POS-COMP-005.json"
    },
    {
      "id": "POS-COMP-006",
      "path": "aset/shared/conformance/positive/POS-COMP-006.json"
    },
    {
      "id": "POS-COMP-007",
      "path": "aset/shared/conformance/positive/POS-COMP-007.json"
    },
    {
      "id": "POS-COMP-008",
      "path": "aset/shared/conformance/positive/POS-COMP-008.json"
    },
    {
      "id": "POS-COMP-009",
      "path": "aset/shared/conformance/positive/POS-COMP-009.json"
    },
    {
      "id": "POS-COMP-010",
      "path": "aset/shared/conformance/positive/POS-COMP-010.json"
    },
    {
      "id": "POS-COMP-011",
      "path": "aset/shared/conformance/positive/POS-COMP-011.json"
    },
    {
      "id": "POS-COMP-012",
      "path": "aset/shared/conformance/positive/POS-COMP-012.json"
    }
  ],
  "document_type": "aset-component-conformance-index",
  "kind": "POSITIVE",
  "schema_version": 1
}
